{
  "version": 2,
  "baseline": {
    "androidCommit": "32a87b253e7cc28273c3850de86242caac83f1fd",
    "tutorialSha256": "11247a43543981fd00d5309d07ecfc4f768b07b0a9586d8b735cac7e91e3493f"
  },
  "entries": [
    {
      "id": "import-schema",
      "family": "import",
      "scope": "source-runtime",
      "androidOwner": "BookSource/JsSourceConfig",
      "androidMethods": [
        "sourceUrls",
        "config",
        "source",
        "mainJs",
        "unknown fields"
      ],
      "tsPaths": [
        "packages/source-core/src/codec/normalize.ts",
        "packages/source-core/src/codec/import.ts"
      ],
      "implementation": "implemented",
      "verification": "ts-passed",
      "feasibility": "fixable",
      "decision": "verify",
      "divergences": [
        "D4"
      ],
      "fixtures": [
        "IMP-001",
        "IMP-004",
        "IMP-005"
      ],
      "members": [
        {
          "id": "import-schema::001-sourceurls",
          "owner": "BookSource/JsSourceConfig",
          "name": "sourceUrls",
          "signature": "sourceUrls",
          "parameters": [],
          "returnType": "unknown",
          "implementation": "implemented",
          "verification": "ts-passed",
          "feasibility": "fixable",
          "decision": "verify",
          "fixtures": [
            "IMP-001",
            "IMP-004",
            "IMP-005"
          ],
          "errorCodes": []
        },
        {
          "id": "import-schema::002-config",
          "owner": "BookSource/JsSourceConfig",
          "name": "config",
          "signature": "config",
          "parameters": [],
          "returnType": "unknown",
          "implementation": "implemented",
          "verification": "ts-passed",
          "feasibility": "fixable",
          "decision": "verify",
          "fixtures": [
            "IMP-001",
            "IMP-004",
            "IMP-005"
          ],
          "errorCodes": []
        },
        {
          "id": "import-schema::003-source",
          "owner": "BookSource/JsSourceConfig",
          "name": "source",
          "signature": "source",
          "parameters": [],
          "returnType": "unknown",
          "implementation": "implemented",
          "verification": "ts-passed",
          "feasibility": "fixable",
          "decision": "verify",
          "fixtures": [
            "IMP-001",
            "IMP-004",
            "IMP-005"
          ],
          "errorCodes": []
        },
        {
          "id": "import-schema::004-mainjs",
          "owner": "BookSource/JsSourceConfig",
          "name": "mainJs",
          "signature": "mainJs",
          "parameters": [],
          "returnType": "unknown",
          "implementation": "implemented",
          "verification": "ts-passed",
          "feasibility": "fixable",
          "decision": "verify",
          "fixtures": [
            "IMP-001",
            "IMP-004",
            "IMP-005"
          ],
          "errorCodes": []
        },
        {
          "id": "import-schema::005-unknown-fields",
          "owner": "BookSource/JsSourceConfig",
          "name": "unknown fields",
          "signature": "unknown fields",
          "parameters": [],
          "returnType": "unknown",
          "implementation": "implemented",
          "verification": "ts-passed",
          "feasibility": "fixable",
          "decision": "verify",
          "fixtures": [
            "IMP-001",
            "IMP-004",
            "IMP-005"
          ],
          "errorCodes": []
        }
      ]
    },
    {
      "id": "parser-default-css",
      "family": "parser",
      "scope": "source-runtime",
      "androidOwner": "AnalyzeByJSoup",
      "androidMethods": [
        "class",
        "tag",
        "id",
        "text",
        "textNodes",
        "ownText",
        "html",
        "all",
        "eq",
        "lt",
        "gt",
        "containsOwn",
        "matchesOwn"
      ],
      "tsPaths": [
        "packages/source-node/src/html.ts",
        "packages/source-core/src/rules/compiler.ts",
        "packages/source-core/src/rules/evaluator.ts"
      ],
      "implementation": "partial",
      "verification": "ts-diff",
      "feasibility": "conditional",
      "decision": "fix",
      "divergences": [
        "D18",
        "D19"
      ],
      "fixtures": [
        "SCH-001",
        "SCH-002",
        "SCH-003"
      ],
      "errorCodes": [
        "unsupported-selector",
        "empty-page"
      ],
      "members": [
        {
          "id": "parser-default-css::001-class",
          "owner": "AnalyzeByJSoup",
          "name": "class",
          "signature": "class",
          "parameters": [],
          "returnType": "unknown",
          "implementation": "partial",
          "verification": "ts-diff",
          "feasibility": "conditional",
          "decision": "fix",
          "fixtures": [
            "SCH-001",
            "SCH-002",
            "SCH-003"
          ],
          "errorCodes": [
            "unsupported-selector",
            "empty-page"
          ]
        },
        {
          "id": "parser-default-css::002-tag",
          "owner": "AnalyzeByJSoup",
          "name": "tag",
          "signature": "tag",
          "parameters": [],
          "returnType": "unknown",
          "implementation": "partial",
          "verification": "ts-diff",
          "feasibility": "conditional",
          "decision": "fix",
          "fixtures": [
            "SCH-001",
            "SCH-002",
            "SCH-003"
          ],
          "errorCodes": [
            "unsupported-selector",
            "empty-page"
          ]
        },
        {
          "id": "parser-default-css::003-id",
          "owner": "AnalyzeByJSoup",
          "name": "id",
          "signature": "id",
          "parameters": [],
          "returnType": "unknown",
          "implementation": "partial",
          "verification": "ts-diff",
          "feasibility": "conditional",
          "decision": "fix",
          "fixtures": [
            "SCH-001",
            "SCH-002",
            "SCH-003"
          ],
          "errorCodes": [
            "unsupported-selector",
            "empty-page"
          ]
        },
        {
          "id": "parser-default-css::004-text",
          "owner": "AnalyzeByJSoup",
          "name": "text",
          "signature": "text",
          "parameters": [],
          "returnType": "unknown",
          "implementation": "partial",
          "verification": "ts-diff",
          "feasibility": "conditional",
          "decision": "fix",
          "fixtures": [
            "SCH-001",
            "SCH-002",
            "SCH-003"
          ],
          "errorCodes": [
            "unsupported-selector",
            "empty-page"
          ]
        },
        {
          "id": "parser-default-css::005-textnodes",
          "owner": "AnalyzeByJSoup",
          "name": "textNodes",
          "signature": "textNodes",
          "parameters": [],
          "returnType": "unknown",
          "implementation": "partial",
          "verification": "ts-diff",
          "feasibility": "conditional",
          "decision": "fix",
          "fixtures": [
            "SCH-001",
            "SCH-002",
            "SCH-003"
          ],
          "errorCodes": [
            "unsupported-selector",
            "empty-page"
          ]
        },
        {
          "id": "parser-default-css::006-owntext",
          "owner": "AnalyzeByJSoup",
          "name": "ownText",
          "signature": "ownText",
          "parameters": [],
          "returnType": "unknown",
          "implementation": "partial",
          "verification": "ts-diff",
          "feasibility": "conditional",
          "decision": "fix",
          "fixtures": [
            "SCH-001",
            "SCH-002",
            "SCH-003"
          ],
          "errorCodes": [
            "unsupported-selector",
            "empty-page"
          ]
        },
        {
          "id": "parser-default-css::007-html",
          "owner": "AnalyzeByJSoup",
          "name": "html",
          "signature": "html",
          "parameters": [],
          "returnType": "unknown",
          "implementation": "partial",
          "verification": "ts-diff",
          "feasibility": "conditional",
          "decision": "fix",
          "fixtures": [
            "SCH-001",
            "SCH-002",
            "SCH-003"
          ],
          "errorCodes": [
            "unsupported-selector",
            "empty-page"
          ]
        },
        {
          "id": "parser-default-css::008-all",
          "owner": "AnalyzeByJSoup",
          "name": "all",
          "signature": "all",
          "parameters": [],
          "returnType": "unknown",
          "implementation": "partial",
          "verification": "ts-diff",
          "feasibility": "conditional",
          "decision": "fix",
          "fixtures": [
            "SCH-001",
            "SCH-002",
            "SCH-003"
          ],
          "errorCodes": [
            "unsupported-selector",
            "empty-page"
          ]
        },
        {
          "id": "parser-default-css::009-eq",
          "owner": "AnalyzeByJSoup",
          "name": "eq",
          "signature": "eq",
          "parameters": [],
          "returnType": "unknown",
          "implementation": "partial",
          "verification": "ts-diff",
          "feasibility": "conditional",
          "decision": "fix",
          "fixtures": [
            "SCH-001",
            "SCH-002",
            "SCH-003"
          ],
          "errorCodes": [
            "unsupported-selector",
            "empty-page"
          ]
        },
        {
          "id": "parser-default-css::010-lt",
          "owner": "AnalyzeByJSoup",
          "name": "lt",
          "signature": "lt",
          "parameters": [],
          "returnType": "unknown",
          "implementation": "partial",
          "verification": "ts-diff",